{
  "schemaVersion": 1,
  "arabianCalendarDataVersion": "2026.09.16-r2",
  "language": "ar",
  "calendar": {
    "id": "suhail_year",
    "name": "السنة السهيلية",
    "alternateName": "سنة سهيل",
    "start": {
      "month": 8,
      "day": 24
    },
    "end": {
      "month": 8,
      "day": 23
    },
    "commonLength": 365,
    "leapLength": 366,
    "leapRule": "تكون الدورة 366 يومًا إذا مر 29 فبراير بين 24 أغسطس و23 أغسطس التالي؛ ويقع 29 فبراير داخل سعد بلع دون تغيير بدايات الطوالع اللاحقة.",
    "firstDayDetailText": "اليوم أول أيام سنة سهيل، التي تبدأ في الرابع والعشرين من أغسطس من كل عام."
  },
  "displayPolicy": {
    "shortAnnouncementTemplate": "سنة سهيل: اليوم {suhailDay}. الطالع: {talaaName}، اليوم {talaaDay} منه. وهو من موسم {seasonName}{folkSubdivisionSegment}. {sayingSegment}",
    "folkSubdivisionSegmentTemplate": ": {folkSubdivision}",
    "sayingSegmentTemplate": "ومن المأثور فيه: {saying}",
    "detailIntroTemplate": "وفي التقويم العربي: اليوم هو اليوم {suhailDay} من سنة سهيل. وهذه السنة {cycleType}، عدد أيامها {cycleLength}، وقد بقي منها {daysRemaining} يومًا.",
    "rules": [
      "الطالع هو وحدة العرض اليومية الأساسية.",
      "لا تكرر المنزلة والنوء في الإعلان المختصر إذا لم يضيفا معنى.",
      "يعرض قول مأثور واحد كامل فقط في اليوم وفق الترتيب المخزن، ثم ينتقل إلى القول التالي في اليوم التالي.",
      "بعد نفاد أقوال الطالع لا يكرر أي قول حتى يتغير الطالع.",
      "لا اختيار عشوائي ولا تلخيص أو اقتطاع للأقوال.",
      "المعلومات المفصلة تعرض الأقسام غير الفارغة فقط.",
      "المصادر داخلية للصيانة ولا تعرض للمستخدم.",
      "شرح اللفظ الغريب يدرج مع موضعه ولا يوجد معجم مستقل."
    ]
  },
  "sources": {
    "MAIN_REF": {
      "name": "المرجع التنفيذي العربي المعتمد لمهمة التقويم العربي",
      "role": "التواريخ والمواسم والمادة الموسمية والتراثية المعاصرة المعتمدة"
    },
    "HARBI_CLASSICAL": {
      "name": "مختصر الأنواء - بندر الحربي",
      "role": "إثراء وصف المنازل والأنواء والأسجاع القديمة"
    }
  },
  "seasons": [
    {
      "id": "suhail",
      "name": "سهيل",
      "start": {
        "month": 8,
        "day": 24
      },
      "end": {
        "month": 10,
        "day": 15
      },
      "length": {
        "common": 53,
        "leap": 53
      },
      "notes": [
        "يبدأ به أهل الجزيرة سنةً موسمية مشهورة تسمى السنة السهيلية عند طوائف من الحاسبين.",
        "يمثل في الذاكرة الشعبية بداية انكسار القيظ تدريجيًا، ولا سيما ليلًا، ويرتبط بنضج الرطب والتمر والصرام والاستعداد للوسم.",
        "في الرواية القديمة يبدأ التبدي - أي الخروج إلى البوادي طلبًا للكلأ ومساقط الغيث - بطلوع سهيل."
      ],
      "startText": "«اليوم أول أيام سنة سهيل، وأول أيام موسم سهيل.»",
      "talaaIds": [
        "tarfah",
        "jabhah",
        "zubrah",
        "sarfah"
      ],
      "sourceRefs": [
        "MAIN_REF"
      ]
    },
    {
      "id": "wasm",
      "name": "الوسم",
      "start": {
        "month": 10,
        "day": 16
      },
      "end": {
        "month": 12,
        "day": 6
      },
      "length": {
        "common": 52,
        "leap": 52
      },
      "notes": [
        "الوسم موسم مطر مشهور، سمي بذلك لأن مطره يَسِم الأرض بالخضرة ويترك أثره فيها.",
        "يرتبط في الموروث بإنبات المرعى والفقع إذا تتابعت الأمطار، وبأعمال الزراعة الشتوية بحسب المنطقة."
      ],
      "startText": "«اليوم أول أيام موسم الوسم.»",
      "talaaIds": [
        "awa",
        "simak_al_azal",
        "ghafr",
        "zubana"
      ],
      "sourceRefs": [
        "MAIN_REF"
      ]
    },
    {
      "id": "murabba_winter",
      "name": "المربعانية",
      "start": {
        "month": 12,
        "day": 7
      },
      "end": {
        "month": 1,
        "day": 14
      },
      "length": {
        "common": 39,
        "leap": 39
      },
      "notes": [
        "من أشهر مواسم البرد في الموروث، وتسمى أربعينية على التغليب مع أن تقسيم الطوالع هنا يبلغ 39 يومًا.",
        "يرتبط أولها بتساقط أوراق الشجر، ووسطها بأطول الليالي، وآخرها بتمكن البرد."
      ],
      "startText": "«اليوم أول أيام المربعانية.»",
      "talaaIds": [
        "iklil",
        "qalb",
        "shawlah"
      ],
      "sourceRefs": [
        "MAIN_REF"
      ]
    },
    {
      "id": "shabt",
      "name": "الشبط",
      "start": {
        "month": 1,
        "day": 15
      },
      "end": {
        "month": 2,
        "day": 9
      },
      "length": {
        "common": 26,
        "leap": 26
      },
      "notes": [
        "برد جاف شديد عند كثير من أهل الجزيرة، ويعرف عند العامة بمقرقع البيبان لكثرة اضطراب الرياح.",
        "يرتبط بالصقيع وشدة البرد في العراء، وتدخل فيه أو تقاربه تسميات شعبية مثل الأزيرق وبرد الطويلين."
      ],
      "startText": "«اليوم أول أيام الشبط.»",
      "talaaIds": [
        "naaim",
        "baldah"
      ],
      "sourceRefs": [
        "MAIN_REF"
      ]
    },
    {
      "id": "aqarib",
      "name": "العقارب",
      "start": {
        "month": 2,
        "day": 10
      },
      "end": {
        "month": 3,
        "day": 20
      },
      "length": {
        "common": 39,
        "leap": 40
      },
      "notes": [
        "يمثل آخر البرد وبداية الانتقال الواضح إلى الربيع.",
        "يقسم شعبيًا إلى عقرب السم ثم عقرب الدم ثم عقرب الدسم."
      ],
      "startText": "«اليوم أول أيام موسم العقارب.»",
      "talaaIds": [
        "saad_al_dhabih",
        "saad_bula",
        "saad_al_suud"
      ],
      "sourceRefs": [
        "MAIN_REF"
      ]
    },
    {
      "id": "hamimayn",
      "name": "الحميمين",
      "start": {
        "month": 3,
        "day": 21
      },
      "end": {
        "month": 4,
        "day": 15
      },
      "length": {
        "common": 26,
        "leap": 26
      },
      "notes": [
        "موسم ربيعي يزداد فيه الدفء وتورق الأشجار وتخرج الهوام والحشرات من مخابئها في الموروث.",
        "ترد فيه حكايات عن عودة برد متأخرة بعد دفء، ومنها قولهم «بياع الخبل عباته»."
      ],
      "startText": "«اليوم أول أيام الحميمين.»",
      "talaaIds": [
        "saad_al_akhbiyah",
        "fargh_muqqadam"
      ],
      "sourceRefs": [
        "MAIN_REF"
      ]
    },
    {
      "id": "dhiraan",
      "name": "الذراعان",
      "start": {
        "month": 4,
        "day": 16
      },
      "end": {
        "month": 5,
        "day": 11
      },
      "length": {
        "common": 26,
        "leap": 26
      },
      "notes": [
        "من أواخر مواسم الربيع في التقسيم النجدي الحديث، وتكثر في بعض أيامه التقلبات والمراويح.",
        "في آخره تدخل كنة الثريا في التقسيم الشعبي المتداول."
      ],
      "startText": "«اليوم أول أيام الذراعين.»",
      "talaaIds": [
        "fargh_muakhkhar",
        "risha"
      ],
      "sourceRefs": [
        "MAIN_REF"
      ]
    },
    {
      "id": "thurayya_season",
      "name": "موسم الثريا",
      "start": {
        "month": 5,
        "day": 12
      },
      "end": {
        "month": 6,
        "day": 19
      },
      "length": {
        "common": 39,
        "leap": 39
      },
      "notes": [
        "تقسيم موسمي عند بعض الحاسبين، ويتداخل أوله مع كنة الثريا.",
        "مع نهايته تظهر الثريا فجرًا في الموروث الموسمي، ويبدأ اشتداد القيظ."
      ],
      "startText": "«اليوم أول أيام موسم الثريا.»",
      "talaaIds": [
        "shartan",
        "butayn",
        "thurayya"
      ],
      "sourceRefs": [
        "MAIN_REF"
      ]
    },
    {
      "id": "tuwaybi",
      "name": "التويبع",
      "start": {
        "month": 6,
        "day": 20
      },
      "end": {
        "month": 7,
        "day": 2
      },
      "length": {
        "common": 13,
        "leap": 13
      },
      "notes": [
        "سمي التويبع لأنه يتبع الثريا، وهو الدبران في اصطلاح المنازل.",
        "يرتبط بازدياد الحر ورياح البوارح في الموروث."
      ],
      "startText": "«اليوم أول أيام التويبع.»",
      "talaaIds": [
        "dabaran"
      ],
      "sourceRefs": [
        "MAIN_REF"
      ]
    },
    {
      "id": "jawza",
      "name": "الجوزاء",
      "start": {
        "month": 7,
        "day": 3
      },
      "end": {
        "month": 7,
        "day": 28
      },
      "length": {
        "common": 26,
        "leap": 26
      },
      "notes": [
        "من مواسم القيظ الشديد، وترتبط بها أسجاع عن كنوس الظباء وشدة الحر.",
        "وتدخل فيها مرحلة من نضج الثمار الصيفية."
      ],
      "startText": "«اليوم أول أيام الجوزاء.»",
      "talaaIds": [
        "haqah",
        "hanaah"
      ],
      "sourceRefs": [
        "MAIN_REF"
      ]
    },
    {
      "id": "marzam",
      "name": "المرزم",
      "start": {
        "month": 7,
        "day": 29
      },
      "end": {
        "month": 8,
        "day": 10
      },
      "length": {
        "common": 13,
        "leap": 13
      },
      "notes": [
        "موسم شديد الحر، ويرتبط في نجد بوفرة الرطب وطباخ اللون.",
        "الموعد البرمجي المعتمد في هذه البيانات يبدأ في 29 يوليو."
      ],
      "startText": "«اليوم أول أيام موسم المرزم.»",
      "talaaIds": [
        "dhira"
      ],
      "sourceRefs": [
        "MAIN_REF"
      ]
    },
    {
      "id": "kulaybain",
      "name": "الكليبان",
      "start": {
        "month": 8,
        "day": 11
      },
      "end": {
        "month": 8,
        "day": 23
      },
      "length": {
        "common": 13,
        "leap": 13
      },
      "notes": [
        "آخر مراحل القيظ قبل سهيل، وتشتد فيه الكتمة والحر مع استمرار نضج الرطب والتمر.",
        "يطلق عليه بعض أهل نجد «محننات الجمل»."
      ],
      "startText": "«اليوم أول أيام الكليبين.»",
      "talaaIds": [
        "nathrah"
      ],
      "sourceRefs": [
        "MAIN_REF"
      ]
    }
  ],
  "overlappingPeriods": [
    {
      "id": "kinna_al_thurayya",
      "name": "كنة الثريا",
      "start": {
        "month": 4,
        "day": 29
      },
      "end": {
        "month": 6,
        "day": 6
      },
      "talaaIds": [
        "risha",
        "shartan",
        "butayn"
      ],
      "description": "فترة يغيب فيها ظهور الثريا في وهج الشمس في التقسيم الشعبي، وتظهر في التفاصيل بوصفها فترة متداخلة.",
      "startText": "اليوم أول أيام كنة الثريا.",